label	sentence1
政务_文旅	安徽三祖寺发现佛牙舍利 初步判断为宋代皇家所赐
科技_数码	员工曝苹果2022年春季发布会要来了！iPhone SE 3即将发布
汽车_行业	俄乌战争使大众向中国和美国转移产能
科技_车科技	再也不怕事故扯皮！所有新车全面上线黑匣子：比行车记录仪好用
体育_中国足球	终身禁赛！体育总局和公安部联手严查严打赌球假球行为
娱乐_电影	9分崩到3分，国剧之王彻底被毁
娱乐_音乐	华晨宇2019演唱会版降临释出 高质量舞美堪称天花板
政务_地方	优化营商环境 江西省打造“15分钟政务服务圈”
汽车_导购	天津车展最便宜新能源推荐 预算2万多就有选择
娱乐_明星	熊黛林居家抗疫陪女儿做功课 母女亲力亲为做手工超有爱
科技_数码	芯片才是苹果最强壁垒
体育_国际足球	土甲球员拒穿“对战争说不”的T恤：我的良心会不适
时尚_情感	在成为母亲之前，她们也只是普通人
科技_区块链	独立游戏发行商itch.io怒批NFT为骗局 顺带Diss了一众游戏厂商
政务_文旅	赏红不必“扎堆”香山，北京多家公园景区进入彩叶观赏期
时尚_时装	法国博主Solene文艺又摩登的穿搭 都能有自己的风格和味道
娱乐_电视	JESSI等嘉宾接连确诊新冠 《第六感3》首期节目将延期
科技_手机	小米Civi产品经理证实：没有小米12青春版了
政务_反腐	重点领域正风反腐观察 猛药去疴遏制靠山吃山
时尚_时装	时隔一年，Vogue中国前总裁公开被辞退内幕！
时尚_时装	张震复古风儒雅大片
政务_政策	北京：春节留京保供家政服务员及其所属企业可获奖励
汽车_新车	全新大众Amarok皮卡谍照 将于夏季亮相/共享福特Ranger平台
娱乐_电视	综艺《大侦探》内容多次遭恶意曲解 节目组将通过法律维权
科技_手机	全新变“拆修” 高价回收套路有多深？
汽车_试驾	怀念吗？向前吧。试驾JEEP新大指挥官
体育_中国足球	韩国女足主帅：双方心态将主导赛果 球队和奥预赛时已完全不同
体育_CBA	正式确定！辽宁名宿替代马布里 出任北控男篮代理主帅
科技_数码	不用等“矿难”显卡价格暴跌多达35%：GTX 1063不足1200元
政务_文旅	2018年“宪法宣传周”活动在呼和浩特启动
汽车_行业	最新融资超20亿 哪吒年内计划赴港IPO
政务_发展治理	农业农村部：猪肉价格已连续12周下降 同比下降约25%
政务_政策	新年各地楼市调控已60余次，房价要降了？
科技_手机	红魔7 Pro游戏手机发布：搭骁龙8配内置风扇 售3999元起
科技_数码	电池锂价疯涨 曝宁德时代减产！官方回应
体育_中国足球	重返中超？记者：有中国球队求购特谢拉 贝西克塔斯正在评估报价
科技_区块链	刷完1427页专利文件 我们发现了Meta的元宇宙秘密
时尚_美容	郑秀妍郑秀晶合影超美艳！
科技_手机	再等等！华为2022新品发布会周期曝光：5月平板、7月Mate
科技_数码	Win10免费升级机会将结束！Windows 11一路狂飙：更新率超20%
汽车_新车	日产全新一代途乐预计2023年发布 或取消V8动力
娱乐_明星	Ella受访谈Selina新恋情：我真的很为她开心
体育_国际足球	大英名宿调侃曼城：蓝月亮再次陷入挣扎 客场35分钟只领先3球
娱乐_电影	豆瓣9.0！这种剧也就他们敢拍了
政务_文旅	武当全域游引全球热捧 “福寿康宁”诠释武当文化
政务_文旅	发改委：降低重点国有景区门票价格，确保国庆前取得明显成效
时尚_情感	豪车名宅还公然在MV里炫富？周董50亿身家这么可怕？
汽车_新车	阿尔法·罗密欧Tonale Quadrifoglio假想图 定位高性能SUV
科技_数码	索尼推出新一代X90K X91K X80K系列电视
体育_中国足球	潘伟力：恒大打算用足校00-01年龄段打中超 03后打中冠
科技_手机	董明珠：电池最本质的就是安全问题 呼吁制定相应的安全标准
娱乐_电视	湖南卫视主持阵容大洗牌，新一哥一姐已有着落？
娱乐_明星	哭得好也被骂？宋祖儿新剧被吐槽，哭戏模式化还是有人太苛刻？
体育_国际足球	欧冠淘汰赛切尔西占先机！各路赛事夺6连胜
时尚_美容	什么面膜好用补水效果好 最好用的补水面膜10大品牌盘点
体育_CBA	2主力缺阵新疆卡位战不敌吉林 琼斯28+8+9齐麟空砍25分
娱乐_音乐	傻子与白痴乐队与“爱的艺术”展梦幻联动 《Year of Fate》新专辑试听会收获好评
汽车_新车	奔驰A级路试谍照曝光 有望今年上半年正式亮相
政务_文旅	城墙南北贯通 故宫这些景点国庆成网红
体育_国际足球	重磅！广州队官方：与五名归化球员终止合同
体育_NBA	10连胜！灰熊击败勇士莫兰特29+8 库里三双迎“里程悲”
娱乐_电视	新丽传媒2022年迎来多部精品爆款“开门红”
体育_国际足球	45岁舍瓦声援老东家：切尔西历史无法被抹去！请将胜利献给我祖国
科技_手机	iPhone 13即将在鸿海集团印度厂量产
政务_地方	高危行业领域强制推行安责险 湖北2022年底将实现参保全覆盖
时尚_情感	11年过去了，侃爷再谈抢话筒事件…
时尚_时装	杨英格精彩演绎迪奥二零二一男士沙滩装限定系列 开启盛夏精彩假期
科技_车科技	沉寂三年半 Uber自动驾驶致死案“安全员”发声：希望得到公正的审判
体育_中国足球	女足官方公布王霜疑似骨裂！亚洲杯决赛带伤踢60分钟 网友：致敬
时尚_时装	白百何黑白镜像时尚大片
科技_数码	AMD显卡新神技登场：白捡3倍性能！
体育_CBA	广东击败浙江迎三连胜！朱旭航三分超神，陆文博伤退，阿联轮休
科技_区块链	这就是扎克伯格的元宇宙？太糙了吧！丨新鲜一点vol.4
体育_NBA	锡伯杜：不管谁在场或缺阵 马刺的比赛风格从不会改变
政务_文旅	紫金城城址与铁河古墓群保护规划正式获批
体育_NBA	奥尼尔表情火了！扣篮大赛失误+尴尬不断 表情彻底生无可恋
科技_区块链	经济日报评论：莫给虚拟货币“矿场”留空间
政务_反腐	长期与管理服务对象打牌赌博，资阳市委原书记陈吉明被双开
汽车_行业	车股月报｜倒春寒，当回暖遇到战争，何时止「跌」？
娱乐_电影	妇女节，贾樟柯带来了这部电影
娱乐_音乐	秋风知再会：李宗盛作品音乐剧《当爱已成往事》2021年巡演地图
娱乐_音乐	只一秒，全中国人DNA都为它动了
娱乐_电视	网剧《唐人街探案》第二季组讯曝光 预计将于2022年6月开机
科技_区块链	印度财政部长：印度人看到了加密货币的未来
政务_发展治理	8.8万家沙县小吃门店是什么概念？
汽车_新车	纯电里程约48公里 北京奔驰GLC插电混动版车型路试谍照曝光
娱乐_电影	婚姻，果真与剧里那般鸡飞狗跳吗？
体育_NBA	剑指卫冕！本赛季雄鹿有多强？双杀篮网+击败湖人 送勇士大溃败
体育_国际足球	生涯新耻！C罗全场0射获6.9分，连续3年成欧冠16郎，双骄时代落幕
科技_手机	OPPO Find X5看点汇总 价格成最大悬念
时尚_美容	哪些蔬菜，是减肥的“坑”？为了瘦多吃蔬菜，谁知却越吃越胖！
娱乐_音乐	受疫情影响 龚琳娜3地音乐会取消或延后
科技_数码	麒麟加持！华为MatePad Paper墨水平板处理器定了
汽车_导购	东风悦达起亚第四代嘉华购车指南 推荐豪华科技款
体育_NBA	篮网有多难？8人应战，格里芬被罚下，单节净负19分后加时获胜
娱乐_音乐	《点赞达人秀》聚焦普通人梦想 农村女孩讲述武术梦落泪
政务_反腐	内蒙古一落马厅官被通报：严重破坏当地工程建设正常秩序
政务_发展治理	西部多省区一季度GDP增速低于全国：外向度低痛失外贸订单回流红利
政务_政策	稳字当头 迎难而上——部门地方稳经济政策密集落地扫描
体育_CBA	篮协官宣处罚两大作弊裁判！叶楠在列，曾怒怼杨鸣：和你没关系
体育_NBA	热议勇士击败太阳！王猛盛赞体系，杨毅：波特扮演了克莱汤普森
科技_车科技	镍价疯涨 锂电遭殃！马斯克难 国产电动车们会更难
政务_文旅	2018假日旅游市场:消费类型多 文化参与度高
政务_地方	到“十四五”期末 江西城镇老旧小区改造将惠及近700万人
时尚_美容	爽肤水哪款好用？这些化妆水，提高皮肤组织更新能力，使肌肤健康
娱乐_电视	克制爱情与上头疯批，《相逢时节》的一体两面
科技_数码	英企开发隐身盾牌：抗极端温度 而且经久耐用
科技_车科技	特斯拉一周内涨价两次
娱乐_电视	国家电影局等六部门：严防借影视基地之名行房地产开发之实
科技_车科技	媲美百万级豪车 华为首辆鸿蒙汽车3月5日开启交付
政务_反腐	公款堆砌的奢靡人生：江苏一会计挪用250万买车、定制整形
科技_数码	纷纷响应制裁俄罗斯：台积电、英特尔、AMD等皆已断供
娱乐_明星	26岁网红意外跌倒后脑死亡，捐献器官救助六人获重生
体育_NBA	隔空对飚库里！杜兰特关键时刻死神降临，率残阵4连胜+冲击MVP
政务_地方	四川省全民健身实施计划出炉，将实施5大工程！
科技_区块链	中国传媒大学启动国内首个开放于元宇宙平台的“虚拟大学”
时尚_美容	美白精华液哪个牌子好 十款真正好用的美白精华推荐
政务_反腐	2020年9月全国查处违反中央八项规定精神问题11929起
汽车_试驾	怎样约到一辆自动驾驶的出租车？
娱乐_明星	还记得董浩叔叔吗？65岁长这样？
体育_NBA	转折点！库里怒踢凳子后豪取4连胜 入选全明星首发感谢球迷支持
时尚_情感	“四千年美女”鞠婧祎被全网黑 没有一次做作是无辜的
时尚_美容	哪个牌子的乳液最好用？这些乳液细腻亲肤不油腻，还能改善痘痘肌
汽车_试驾	当品牌向上遇到领克09，有惊喜也有挑战
政务_发展治理	湖北清明假期接待游客1170万人 赏花短途游占主导
科技_车科技	突发！图森未来拟作价10亿美金出售中国业务 未来将专注美国市场
政务_政策	速看！不止年终奖、十三薪，年底还有这几笔钱能领
科技_手机	评论：两颗芯的OPPO Find X5系列值得买吗？
政务_地方	提升存量能级再塑社群生态 青岛全方位推动城市更新
汽车_行业	深现场 | UNI-K iDD显山，长安新能源露水
时尚_情感	张月：谢谢大家讨厌林有有
体育_NBA	10万8000美元！库里全明星疯狂砍分为捐款家乡
时尚_情感	小李子最爱前女友，如今是世界收入最高超模，丈夫背景吊打小李子
体育_中国足球	人民日报：中国女足做出了榜样！
体育_国际足球	切尔西下赛季主场球衣曝光 球迷：像小孩涂鸦
时尚_美容	你适合披发还是扎发？就看这三个脸部特点，修饰脸部曲线
汽车_行业	捷尼赛思全系车型连续四年获得北美“最佳安全选择+”评级
科技_区块链	福布斯：对2022年区块链、加密资产、DeFi和NFT的10个预测
科技_手机	苹果iPhone SE 3代工厂曝光：鸿海、纬创负责主要组装
科技_5G	高通发布X70 5G调制解调器 下载速度达10Gbps
体育_CBA	开门黑！广东不敌广厦，易建联8+13赵岩昊30分，孙铭徽被驱逐
政务_地方	重庆启用一体化信用融资服务平台 缓解中小微企业融资难题
科技_区块链	NFT距离元宇宙只差一个周杰伦
政务_地方	陕西稳步推进5个旅游项目融资建设
政务_政策	公安部再推9项交管新措施
汽车_导购	【马自达CX-30小彩蛋】那些配置表以外的小心机，才是给新生代的真正惊喜
汽车_行业	俄乌战争下，风雨飘摇的欧洲车业
汽车_试驾	大空间之外的小乐趣 场地试驾星途凌云
娱乐_电影	《如果有一天我将会离开你》片段海报双发 今日暖心上映
娱乐_电影	《神秘海域》预售开启 荷兰弟“突破极限”揭秘动作拍摄难度爆表
体育_中国足球	王霜鼓励球队：就在今晚 看我们的
时尚_美容	洗面奶什么品牌好 全球清洁洗面奶排行榜10强
体育_中国足球	东南亚足坛大洗牌！东帝汶、老挝力压劲敌 与越南会师U23杯4强
科技_数码	小米投资AR光学硬件研发商至格科技
政务_发展治理	这8个地方AI产业规模占全国80% 北京深圳企业最多
体育_国际足球	英国宣布制裁俄罗斯后，俄亿万富翁放弃切尔西俱乐部的管理权
体育_国际足球	良心老板！阿布20年砸23亿买人足坛第1 造切尔西21冠+大满贯伟业
娱乐_电视	日版《来自星星的你》惨遭差评 难以超越原版“千颂伊都敏俊”
娱乐_电视	成年人的爱情，太好嗑了
汽车_行业	看见中国汽车 不可忽视的向上力量
政务_政策	广东8类特定人员纳入工伤保险覆盖范围 多少人已参保？
科技_数码	消息称海康威视计划以550万美元购买ASML二手设备
娱乐_明星	44岁吴佩慈近照曝光，六年为富商生四胎至今仍没名份
时尚_情感	明星有必要比学历吗？业务能力更重要，但高学历仍是吸睛点
体育_NBA	詹姆斯：最后一个赛季我将和儿子同队打球
政务_政策	国家发展改革委建立违背市场准入负面清单案例归集和通报制度
汽车_行业	欧拉黑猫白猫“停产” 撕开A0级电动市场残忍一面
科技_区块链	为什么持有NFT不等于获得了版权？
娱乐_电视	《奇迹·笨小孩》现实题材传递幸福力量 文牧野书写平凡人物奋斗精神
体育_NBA	泪目！库里加冕三分王，追梦格林谈唯一遗憾：克莱不在现场见证
娱乐_电视	《流光之城》“火烧鸦片”引争议 导演发文回应：无声胜有声
汽车_试驾	不插电的增程混动 试驾东风日产e-POWER轩逸
体育_NBA	奇才当家球星比尔赛季报销 顶薪合同或与他无缘
科技_5G	中国6G重大突破 4小时发射3颗卫星 美国态度大变：请求合作
政务_地方	立足长城保护“朋友圈”，甘肃这份规划咋解读？
娱乐_明星	网友偶遇向佐夫妇逛超市 郭碧婷腰身圆润疑有孕
时尚_时装	被31岁的林允儿疯狂种草泡泡袖公主裙 是种什么体验？
娱乐_电影	一会华人骄傲一会辱华，能不能安静看电影？
娱乐_电视	《我们的婚姻》临近大结局，10个角色塑造排名，白百何第二
政务_政策	涉及报销事项！25地加入增值税电子专票“朋友圈”
体育_国际足球	瑞典足协：瑞典目前不可能与俄罗斯进行世预赛附加赛
体育_国际足球	欧冠8强出炉：英超西甲各3队成赢家！尤文出局，意甲法甲全军覆没
政务_政策	河南暴雨中的“致命细节” 引发城市“极限治理”思考丨政邦报告
政务_发展治理	国民全人群接种来了！我国将构筑最大免疫屏障
时尚_美容	张哲瀚被封杀，这“狐系男”怕是要统治内娱审美
科技_手机	“高能传送”：苹果春季发布会hashflag图标Logo已在Twitter特别上线
时尚_美容	羽西「鎏金CP」  妆养双效 凝时驻颜  第二代鎏金瓶精华+全新鎏金粉底液8月重磅上市
科技_手机	曝iPhone SE2手机要降价：这个价位你会买吗？
体育_国际足球	瓜迪奥拉：不信克洛普会放弃 拿96分才能确保夺冠
汽车_行业	太猛了！2022年通用电动皮卡产量或增加六倍？
科技_5G	国务院：加大6G技术研发支持力度 加快布局卫星通信网络等
娱乐_电视	《红海行动》摄影师拍新片意外坠亡 主演炎亚纶停工为其讨说法
时尚_美容	一场奥运会让我看尽了人间百态......的发型
政务_地方	甘肃文旅“小目标”：打造“千亿级产业链”
时尚_情感	容貌焦虑，是一种怎样的体验？
政务_反腐	哈尔滨老旧小区改造中27份质检报告涉造假 43人被查处
娱乐_明星	3月过半就有10位明星去世，8位老艺术家，最小才28岁
体育_国际足球	基辅迪那摩主帅卢塞斯库：不会离开基辅 我不是懦夫
时尚_情感	“男友力”正流行，早秋就穿它，让你和“战神”一样气场两米八
政务_政策	离婚冷静期就要来了 新流程绕不过这几个“30天”
娱乐_电影	《喜鹊谋杀案》：案中案的推理让烧脑加倍
时尚_情感	孟美岐：我只要让我喜欢的人喜欢我
科技_数码	iPhone 13/13 Pro绿色图赏：新配色有啥不一样？
汽车_新车	新款起亚Telluride谍照曝光 内外均有调整
时尚_时装	时候到了！来跟“啤酒妹”和博主们学做卫衣Girl
汽车_导购	硬件为王，调教为后，嘉悦X7的底盘都有哪些亮点？
科技_车科技	强到在F1赛事被Ban掉设计的路特斯 要带着新车杀回来了
科技_区块链	美国特勤局：有关加密货币的投资交易不构成犯罪
体育_NBA	加冕历史三分王！库里正式超越雷阿伦，盘点生涯10大里程碑时刻
汽车_新车	全新MINI COUNTYRMAN谍照曝光 有望年内发布
时尚_时装	明星运动员，离完美时尚代言人有多远？
体育_国际足球	仍任俄超冠军助教并沉默！拜仁巨星被围攻：他已不配称乌克兰传奇
汽车_行业	优步扭亏为盈，需求恢复到疫情之前
政务_反腐	落马干部：老板送我10万不敢收，说“借给你”的就收下了
汽车_新车	采用双液晶屏设计 国产MINI内饰谍照首次曝光
政务_反腐	违纪违法党员干部忏悔录：“理想信念出问题”成最高频关键词
科技_数码	索尼α7R V或将于3月底发布：9500万像素
汽车_行业	大众汽车正考虑在美国生产电动皮卡
政务_反腐	河北涞水县委原书记王义民单次受贿达千万，多次以借为名受贿
时尚_情感	“世界最美面孔”朱珠，国内查无此人在国外却爆红，人生相当传奇
时尚_时装	罗云熙亮相迪奥梦之设计师成都展览开幕酒会 诠释绅士不凡格调
科技_数码	16GB内存的MacBook三年前不卡 现在为何卡了？程序员解答
时尚_情感	一眼沦陷，连刷八集，爽飞
体育_中国足球	冯潇霆巅峰时期年薪1850万！买房增值5倍 去年读了40本书
汽车_新车	未来国产X5L新对手 理想L7路试谍照曝光
政务_发展治理	20省份公布一季度GDP数据，6省份增速跑赢全国
科技_区块链	Salesforce有意推出NFT云服务 瞄准艺术家
科技_区块链	内蒙古法院首次运用“区块链证据核验”审理案件
时尚_情感	情商高的男人，哪个女孩不爱呢？
汽车_新车	雷诺发布Austral内饰预告图 3月8日将亮相
体育_NBA	掘金终结勇士3连胜！约基奇22+18关键盖帽，库里三分球创历史
汽车_行业	 汽车两会｜张兴海：以国家力量推动国产车规级芯片产业崛起
政务_反腐	陕西落马厅官王晓明案细节：收受66人两千两百多万元
时尚_美容	易烊千玺少年魅力的成熟蜕变
时尚_时装	Angelababy优雅大片化身光影下的美人
政务_地方	好品山东丨开往齐鲁新篇章的2022次列车全速前行，一起向未来！
汽车_导购	看懂白车身：您的全家快乐车现已加入特惠套餐
娱乐_音乐	薛之谦“天外来物”海口站正式官宣 星际幻想期待值无限叠加
科技_5G	华为郭平：坚持全球化战略 提升中长期竞争力
时尚_时装	檀健次随性少年感氛围感
娱乐_音乐	阿黛尔官宣新恋情后首现身 男友贴心开车门尽显绅士风度
汽车_新车	宝马iX5氢燃料电池车测试曝光 2022年下半年投产
政务_政策	八部门：逐步扩大高值医用耗材集中带量采购覆盖范围
汽车_行业	2022年开局，谁势头最猛？
汽车_试驾	喜欢驾驶的年轻人，别辜负了工程师的一番苦心
政务_发展治理	“扫码点餐”要先关注公号，方便还是为难顾客？
科技_车科技	李书福还要换电 雷军只要快充
娱乐_电影	《精灵旅社4》发布变身海报 精灵首次变成人 形象反差超惊喜
科技_手机	苹果憋大招：旗舰新iPhone与Mac Fold齐曝光 完美双折叠屏
汽车_行业	崔东树：2021年北京新能源汽车渗透率达22%
科技_车科技	特斯拉回应上海工厂停产：配合防疫要求 努力保障生产
娱乐_电影	Netflix暂停俄罗斯项目制作及收购 《安娜·K》等被叫停
体育_NBA	勇士利好！太阳吞惨败，克莱复出有望率队结束连败+西部登顶
科技_区块链	一个作品拍出5.8亿元！周杰伦试水的这个项目又火了
时尚_美容	哪个品牌的身体乳最好用 十大口碑最好的身体乳排行榜
体育_中国足球	中国女足1300万夺冠奖金到位 水庆霞教练组独享300万
娱乐_明星	好友晒与大小s合照被具俊晔点赞 大s素颜出镜状态回春
体育_国际足球	当切尔西失去阿布，这家百年俱乐部将遭遇什么
汽车_导购	与Z世代同进化 这是一汽丰田卡罗拉的“常青术”
娱乐_电影	《神秘海域》发布“致敬成龙”片段 荷兰弟自曝动作灵感来源成龙
科技_5G	美国5G机场布网“卡壳”  全球5G落地仍面临多重挑战
科技_车科技	意大利计划为电动汽车消费者提供补助 购买24万元的车可获得4万元补贴
体育_NBA	欧文复出！篮网实现大逆转 师弟险搅局
政务_政策	十问延迟退休！“打工人”关心的都在这里
时尚_情感	上斩天王下斩直男！网红脸的核心魅力是尖下巴大眼睛吗？
娱乐_电影	《长津湖之水门桥》票房破40亿 系列总票房已达97亿
政务_地方	5个部分22项重点任务 2022年河北防汛抗旱工作这样干
时尚_美容	150多年的彩妆神话，曾比肩香奈儿，正逐渐被大家遗忘...
汽车_行业	缺芯之年，奔驰如何逆势利润增长近五倍？
体育_中国足球	史诗逆转！补时绝杀！国足3-2力克韩国 成亚洲杯9冠王
科技_手机	进一步看齐苹果：三星确认A系和M系机型不会标配充电器
政务_政策	家庭中劳动者占比不低 延迟退休应考虑照看服务
体育_中国足球	女足亚洲杯决赛：肖裕仪补时绝杀 中国3-2逆转韩国
体育_中国足球	中国女足火出圈！国乒+中国女排发声祝贺 影帝影后盛赞：伟大
时尚_时装	杰尼亚2022冬季系列：从公路旅行中汲取灵感
政务_地方	四川省推进“科技创新巾帼行动” 鼓励科研单位设立女性科研专项
科技_车科技	购买Model 3展车货不对板！特斯拉被判行为不当 却无需赔偿
时尚_美容	什么品牌的眼霜好用 口碑最好的眼霜排行榜前十名
体育_NBA	里夫斯绝杀！湖人加时击败独行侠，詹姆斯24分，浓眉哥20+12
科技_车科技	松下将于2024财年开始为特斯拉量产4680型电池
时尚_情感	被喷又丑又老没演技的她竟搭上顶流男星演女主 难道全凭一张脸？
娱乐_电视	《相逢时节》“领衔主演”变“领街主演” 网友被赞好眼力
科技_数码	再等等！华为2022新品发布会周期曝光：5月平板、7月Mate
科技_数码	苹果无奈iOS 15被破解：漏洞晒出 很快有越狱工具
科技_车科技	小鹏腰斩、蔚来垫底 2月难倒新势力
汽车_试驾	极星2单电机长续航版：差点就能环岛一圈
汽车_行业	2022年北京计划新增推广应用800辆以上燃料电池汽车
汽车_导购	2021天津车展：智能汽车谁家强？看硬件更得看软件
政务_发展治理	三部门发文进一步做好防止因病返贫动态监测和帮扶
时尚_时装	李易峰帅气型男大片
时尚_美容	再多防晒霜也挡不住这个东西！直接进入真皮层
科技_数码	苹果20英寸折叠机啥东西？全触摸版MacBook加iPad
娱乐_明星	名利场||二月有新欢，三月与旧爱又有一女，世界首富专注生娃的18年
政务_发展治理	美丽中国建设迈出重大步伐——各地贯彻落实六中全会精神建设生态文明观察
时尚_美容	青少年适合用什么护肤品 青少年护肤品牌排行榜前十名
体育_NBA	941天后的紧张、凶猛、果决与偷笑：克雷·汤普森，欢迎归来
时尚_时装	李宇春复古摩登风大片
汽车_试驾	一汽-大众ID.4 CROZZ：特斯拉，准备接招了
汽车_导购	又一款国产SUV挑战哈弗H6 传祺GS4的实力不容小视
体育_NBA	我们为什么热爱诺维茨基？因为忠诚永恒
政务_文旅	中土双方调研改善中国游客旅游安全环境
科技_数码	日本光刻胶大厂旗下工厂发生爆炸事故
娱乐_音乐	收编与自我阉割后，中国说唱去向何方？
时尚_情感	亚洲第一男神木村拓哉约会照曝光！网友慕了：啊！这该死的爱情
政务_地方	“海陆空地”齐头并进，山东绘就立体化交通网“蓝图”
体育_NBA	争议！林书豪被问是否支持好友王力宏？瞬间脸黑，被直接拉走
政务_政策	红包、火锅、年夜饭，高校为留校学生“花式送温暖”
科技_手机	三星：Galaxy S22系列和Galaxy Tab S8系列今日全球上市
时尚_美容	别“土”了！拒绝红血丝霸占你的脸
娱乐_电影	欧洲电影奖将剔除俄罗斯影片 乌克兰名导谢尔盖·洛兹尼察发声反对
时尚_时装	王子异油画感复古大片
娱乐_电影	日本导演榊英雄被曝对女演员实施性暴力 新片《蜜月》取消上映
体育_国际足球	120分钟中国女足2-2绝平日本 双方进入点球大战
科技_数码	AMD明天发布新版显卡驱动 RSR功能将上线
