label	sentence1
体育_CBA	比赛中断！马布里和李春江起口角冲突，怒指对方+爆粗不断
科技_数码	1万兆下载！高通发布第五代5G基带：全球唯一、全球首次
科技_车科技	全新纯电动车e:NS1下线 东风本田迎来第700万辆里程碑
娱乐_音乐	欧阳娜娜大湾区中秋写真浪漫柔美 秀无暇香肩气质撩人
时尚_美容	实力够A 眼力上分  Elizabeth Arden 伊丽莎白雅顿智囊ACE眼霜卓效上新
娱乐_明星	为男足发声被群嘲 李佳航宣布关闭社交账号
体育_中国足球	前国脚杨旭声援冯潇霆：我们习惯被骂但没麻木！巩汉林不该如此发泄情绪
汽车_导购	咖啡智驾生态构想：未来汽车是四个轮子+超级计算机？
汽车_试驾	四条国际赛道的party 一汽丰田全系冰雪试驾
娱乐_电影	惊悚悬疑烧脑，这部小众剧真带劲
政务_地方	高校疫情防控 重庆教育系统要求做到这六个方面
娱乐_音乐	《当爱已成往事》山西站完美收官！江湖酒吧感动延续
汽车_试驾	性能油耗兼得 试驾魏牌摩卡DHT-PHEV
时尚_时装	这一次，Virgil Abloh 把服装发布变成了一场先锋戏剧
政务_政策	南京落户新政：持居住证六个月以上社保即可落户
娱乐_音乐	黄征胡海泉同台却零互动？其实十年前就已结怨
政务_政策	CPI同比下降 11年来首次！猪肉“立功”！
政务_政策	2月份CPI今日公布：同比或继续负值
汽车_试驾	寻找心中的春色 试驾沃尔沃XC40
娱乐_明星	名流||匪夷所思，有钱人会在他们旅行箱里装什么？
娱乐_电影	《神奇动物3》官宣定档4月8日 上映日期比北美提前一周
政务_政策	6月新规！婚姻登记试点跨省通办 20城可异地交易二手车
时尚_时装	龚俊酷飒造型风格大片
体育_CBA	中国男篮归来！全队隔离21天，将无缝衔接CBA，官方感谢周琦
体育_中国足球	吴曦迎33岁生日！国足官方送祝福 却遭球迷嘲讽：海参+躲球
政务_发展治理	江西探索绿色低碳转型新路径 严控“两高”项目盲目发展
政务_政策	对标纽约、巴黎、东京：GDP十强城市如何建成国际消费中心城市
科技_车科技	特斯拉在美国部分地区订单激增100%
娱乐_音乐	向阳而生，拥抱春天！第二届华语音乐剧大赏圆满落幕
政务_反腐	德阳市政府原副秘书长受贿超千万获刑12年，不收房子只要钱
时尚_美容	阿玛尼美妆继续作为威尼斯国际电影节官方主力赞助商 引入全新奖项加强合作
科技_手机	天玑8000系列发布：台积电5nm制程 OPPO、Redmi等将首发
体育_NBA	曝哈登希望夏天离开！不喜纽约天气变化 税收差距影响大
娱乐_电影	《花束般的恋爱》：文青的爱情真的没有市场了吗？
时尚_情感	爱妻人设崩塌？说唱歌手大尺度撩女粉，昔日兄弟直接反目成仇
娱乐_电影	《你是我的春天》曝“春日色彩”海报 群星“眼技”凝望人间温暖
科技_车科技	网传代驾电车自燃 烧毁数百万元奔驰大G！
科技_5G	国内三大运营商2021年日赚超4亿！万亿巨无霸成吸金王
体育_中国足球	如鸟兽散！具备归化资格外援决定回国 一华裔归化亦考虑离去
时尚_美容	杨幂鞠婧祎都在用的唇霜唇泥真的值得买吗？
科技_数码	擦屏布小场面！苹果1.8米连接线卖949元引网友吐槽
汽车_行业	冯思翰：疫情对大众在华生产影响不致命
体育_国际足球	动荡！世预赛受影响+欧冠决赛换地 基辅和矿工外援纷纷求助
体育_中国足球	中国女足抛起主帅庆祝！功臣霸气表态：就是来夺冠的
科技_数码	你看到的口碑 都是刷出来的
科技_车科技	网易丁磊两会提案：提倡全民急救教育、电动自行车安全治理等
时尚_情感	佟丽娅离婚：当一个女人决定自救，婚姻就变得可无可有
科技_手机	苹果 iPhone SE 3确认配备4GB内存 前代仅有3GB
科技_数码	已有跳绳App支持苹果AirPods 3/Pro无线耳机运动传感器计数
时尚_美容	Adele减肥后惊艳Vogue封面！公开减肥经历：两年瘦了100磅，为了让自己更强
汽车_行业	2022政府工作报告：维护产业链供应链安全稳定
娱乐_电视	是安《我们的婚姻》圆满收官 网友大赞：剧抛型演技
政务_发展治理	超限车给执法车装跟踪器，暗访成公开的秘密 助虐者谁？
体育_CBA	辽宁26分轻取福建 付豪两战狂轰61+21打出巅峰表现
体育_CBA	利好！中国女篮8人转阴唯一确诊球员已出院  距回国越来越近
时尚_情感	王子文官宣恋情上热搜，陈乔恩疑似怀孕却被骂：女神为什么卑微？
汽车_导购	新年买纯电动车推荐你等等？尝鲜还能得实惠
体育_中国足球	FIFA官网发文祝贺中国女足夺冠：铿锵玫瑰 逆风绽放！
科技_数码	戴口罩Face ID来了！苹果iOS iPadOS 15.4正式版更新发布
娱乐_音乐	演出取消|李宗盛作品音乐剧《当爱已成往事》北京站演出延期举办
科技_数码	俄乌局势很扎“芯”？
政务_发展治理	加快建设国际消费中心城市，上海将出台12条促消费举措
娱乐_音乐	音乐剧《当爱已成往事》常熟站首场开演！王筝王凯坐镇，打开思念阀门
汽车_行业	印度拒绝减税，逼特斯拉在当地建厂
政务_发展治理	重磅！多地出大招严打炒房：严查贷款业务，中介机构遭约谈
科技_车科技	马斯克自曝特斯拉名字来历：花了7.5万美元 在别人家门口软磨硬泡要来
科技_车科技	集度汽车量产车型将于11月广州车展亮相 2023年上市
政务_文旅	湖北随州发现一处大型东周遗址
娱乐_电影	曾经的那套神剧，又回来了
政务_地方	山东今年前两个月外贸增长14.5%，“一带一路”增长27.2%
时尚_时装	EVA除了有你一辈子都用不完的联名外，26年来还为我们留下了什么？
娱乐_电视	这节目没被骂，出奇了！
科技_数码	俄乌冲突带来系列影响：扰乱芯片原料供应 汽车股大跌
政务_反腐	上诉20次依然被引渡回国，外逃腐败分子逃不脱的“天网”
娱乐_电视	黄轩王一博宋茜《风气洛阳》将于5月在日本播出 具体时间待定
时尚_情感	陈伟霆演绎拼色混搭风
娱乐_明星	景甜分享海边工作随拍 穿吊带裙工装裤风格多变
政务_发展治理	国家卫健委：推动生育登记网上办、掌上办、一次办
娱乐_明星	猫狗系警官？《猎罪图鉴》金世佳檀健次惊险追凶，拿画笔当武器？
科技_数码	多年罕见！NVIDIA内部通知：大降价
科技_车科技	俄乌冲突殃及池鱼 韩国最受伤？
时尚_美容	敷面膜的3个错误做法，对皮肤有坏处
科技_手机	苹果无奈iOS 15被破解：漏洞晒出 很快有越狱工具
体育_NBA	小塔克致命失误！巴特勒三双热火复仇湖人 詹姆斯空砍33+11+4
娱乐_明星	福原爱写给横滨男的情书曝光，网友变脸挺江宏杰：欠你一个道歉
体育_中国足球	中国女足6日将冲亚洲冠军 水庆霞：更看重比赛本身的胜利
科技_车科技	顽疾：小鹏的交车时间是个迷
娱乐_电影	第28届美国演员工会奖获奖名单出炉 威尔·史密斯与杰西卡·查斯坦分获影帝后
时尚_美容	爽肤水推荐：皮肤变得洁净、清爽，更柔软平滑令妆容更加鲜亮持久
娱乐_音乐	打卡纪念第一次在岛上演出的“江湖酒吧”《当爱已成往事》海口温暖首演
汽车_试驾	试驾2021款凯迪拉克XT5/XT6 轻混动，大不同
时尚_情感	走红之后的李宏毅，从倔强少年到职业演员
时尚_时装	Love United爱酷联合国  MO&Co.×little MO&Co. FW 2021 Fashion Show
科技_区块链	价值200万美元的BUG！iOS越狱之父发现关键漏洞获奖
汽车_行业	投资110亿 美的新能源汽车零部件新基地开工
科技_区块链	10年来最差开年！比特币跌破4万美元，加密货币总市值缩水至2万亿美元以下
汽车_导购	全新奥德赛全方位进化 哪款才是最优之选
科技_手机	三星首款5G三防手机Xcover Pro 2曝光 或今年夏天发布
汽车_试驾	比亚迪宋PLUS EV：奏响大宋王朝最强音
科技_车科技	奇瑞集团：2月新能源汽车销售10702辆 同比增长446.9%
时尚_时装	这几招扎头发技巧，学会了谁还要披头散发啊！
科技_车科技	美国奥克拉荷马州通过新法规 将强迫特斯拉退出市场
时尚_时装	时髦办|她是抢赢过上帝的女人张冬天啊
体育_NBA	NBA全明星首发出炉：詹姆斯杜兰特斩获票王 威金斯生涯首次入选
汽车_导购	全场景多功能性优异，体验ATLAS品牌的SUV专用轮胎
科技_手机	实测结果告诉你！手机厂商跟相机品牌合作图什么
娱乐_音乐	TMA颁奖礼回应ASTRO舞台抄袭争议：是制作组的失误
科技_区块链	马斯克玩砸了：炒币亏了6个亿 未来还要继续亏？
体育_CBA	郭艾伦遭驱逐！辽篮7人得分上双击败福建，高登空砍46+6+8
汽车_行业	财报全视角 | 理想又盈利，但不解4大焦虑
体育_中国足球	胡毓堃：重夺亚洲杯，中国女足需要的不只是高光时慕名而来
时尚_美容	怀念年轻时的眼睛？清澈无纹难道一去不复返了吗？
科技_手机	格力董明珠：会“坚持做手机” 做手机不是为了抢占市场份额
娱乐_电视	《相逢时节》剧情再起波澜  雷佳音袁泉迎接纷繁生活难题
政务_发展治理	政策叠加效应显现 广州五一楼市走势趋稳
娱乐_电视	凤娱指数 ｜《黑金风暴》：港剧最拿手的探案题材，也拍不出花了
汽车_试驾	二胎家庭的福音 试驾江铃福特全新领裕
体育_中国足球	迎来曙光！重庆队股改有望加快推进 当代集团出局债务分割函
科技_手机	vivo X Fold折叠屏手机爆料：居中单孔曲面外屏+后置全焦段四摄
科技_车科技	最高涨3万元 零跑C11全系车型售价调整：17.98万-22.98万元
体育_中国足球	0-2落后！中国女足陷绝境，裁判引争议：王霜被下黑脚+点球不判
体育_中国足球	热搜第1！冯巩嘲讽国足太软 董路回击：春晚小品抄段子没长进
娱乐_电影	冬奥电影《我心飞扬》举行黑龙江首映式 冰雪健儿亲临互动
时尚_时装	TA好美，却注定被“毁掉”
汽车_导购	东风日产新一代奇骏购车指南 推荐购买豪华版车型
体育_CBA	CBA最新排名！辽篮领跑，广东跌出前三，首钢崛起，新疆5连败堕落
体育_国际足球	遗憾！武磊单刀良机被扼杀：逼迫阿根廷国门禁区外手球被无视
体育_国际足球	舍甫琴科参加反战游行！晒图发文：停止在乌克兰的战争
体育_国际足球	C罗发视频送冬奥祝福 宠粉秀中文：新年快乐
科技_数码	iPhone 13新配色发布：果然够绿
政务_文旅	故宫养心殿研究性保护项目正式进入修缮阶段
政务_政策	北京：出售车辆后申请更新指标无时限 元旦前不必扎堆买新车
政务_政策	返乡人员如何划定？核酸检测证明如何获得？国家卫健委权威回应来了
科技_数码	地表最强PC、最聪明的显示器、最绿的iPhone 13 全给苹果占了！
体育_NBA	全明星第三期票选结果出炉！詹姆斯反超库里 哈登拉文紧追特雷杨
政务_反腐	贵州茅台学院原副院长李明灿涉嫌受贿犯罪被移送检察机关
体育_CBA	林书豪空砍21+5+4 首钢爆冷吞赛季第10败
科技_车科技	马斯克：特斯拉或许应该制造一款可以连接交通灯的AI视觉设备
娱乐_音乐	音乐剧《当爱已成往事》济宁站圆满结束，“江湖酒吧”感动延续...
政务_地方	去年甘肃“审”出问题资金逾110亿元
科技_区块链	“元宇宙第一股”来了：赚钱能力存疑 行业风险未知
科技_手机	成本是传统手机镜头防抖的2倍 Find X5顶配卖7999曝光了
时尚_时装	张颜齐暖秋大片慵懒时髦
科技_手机	苹果憋大招：旗舰新iPhone被曝光！完美了
科技_数码	VR苹果都不看重！它还能活多久？
科技_手机	2149元起！华为新机上架：骁龙680、原生4G
娱乐_明星	网友偶遇谷爱凌街头跑步 妈妈笑着骑自行车陪同
体育_CBA	天津三分雨破7年不胜首钢怪圈 弱旅3连胜找到胜利感觉
娱乐_音乐	娱乐圈最大性侵案判了！天王巨星囚禁无数少男少女，或被判100年
体育_中国足球	原天津泰达董事长董文胜被逮捕！
政务_文旅	127位抗战老兵“亮相”抗战馆
时尚_美容	手把手教你画出氛围感节日妆容，明艳自然又上镜
汽车_行业	开年“掉队者”：五菱宏光MINI？、欧拉“给钱不卖”、威马禁声
体育_中国足球	足球报：最严限薪令即将发布 中超球队投资上限降为3亿
政务_政策	最高检第九检察厅：深化未成年人全面综合司法保护
娱乐_电影	派拉蒙环球发表声明！好莱坞五大电影公司全部暂停新片在俄上映
科技_手机	全球5G智能手机销量在1月份首次超过4G
娱乐_电影	刘青云蔡卓妍组团《神探大战》 老搭档聚首新生代抢镜
体育_NBA	神剧情！湖人抹平23分差距+逆转失败，詹皇遭隔扣，威少再度背锅
政务_反腐	湖北巴东打掉一把“保护伞”：政法委原书记吉德平被移送司法
汽车_行业	腾势首款高端MPV谍照曝光  4月正式亮相
政务_反腐	首次披露！深夜11点，这个“老虎”在留置书上签字、按手印
汽车_行业	汽车315｜延期交车，算侵权吗？
时尚_美容	唯稀有者享稀有 MATIERE PREMIERE / 马蒂埃 · 典藏香水
政务_发展治理	商务部：4月我国消费市场继续呈稳步恢复态势
体育_中国足球	吴金贵正式回归 再次出任中超上海申花队主教练
娱乐_电视	凤娱指数｜《不会恋爱的我们》：没有创新，再甜也难以下咽
娱乐_电影	《精灵旅社4》定档4月3日 精灵变人类囧途好嗨森
汽车_行业	俄乌战争剧震资本市场，MobileEye为何冒险IPO
时尚_时装	文淇露额公主切大片
时尚_情感	张艺谋，人走茶凉
汽车_行业	 汽车两会｜尹同跃：将动力电池材料纳入国家战略储备资源管理
汽车_行业	谁是货运“滴滴”？快狗上市能起多大浪？
汽车_试驾	车机升级/换装高功率动力 试驾五菱凯捷280T
汽车_试驾	保时捷2021尽享跑车日：第一视角走进这场狂欢
体育_NBA	硬汉！保罗拇指骨折手腕缠胶带打全明星
政务_发展治理	“快消”城市之辨：在打卡中消亡的网红建筑
汽车_行业	宝马集团：并表华晨宝马将带来70-80亿欧元
政务_反腐	干部受处分后又6次违规接受宴请 屡教不改从重处理
娱乐_明星	汪峰夫妇深夜十指相扣现身酒吧 章子怡给好友比心俏皮可爱
政务_发展治理	“人口十强城市”格局重塑：成都首破2000万 西安郑州同晋级
科技_车科技	网曝小鹏P7“刹车失灵”：踩刹车无用 眼睁睁撞墙
政务_反腐	茅台学院新任党委书记到任当日，副院长被通报落马
政务_反腐	以“空本放贷”受贿涉案超千万元，一原检察长获刑12年半
时尚_美容	换季也有元气肌！娇兰第三代黄金复原蜜新品评测！
体育_CBA	萨林杰34+13深圳险胜浙江 沈梓捷带伤砍17+10
科技_区块链	美国司法部开展有史以来最大金额执法行动 缴获超36亿美元比特币
政务_地方	开门红！今年前两个月江西省进出口同比增长30.9%
科技_手机	消灭挖孔！摩托罗拉edge X30屏下版发布时间曝光：3月见
娱乐_电视	《尚食》热播高甜之后高虐  “基衿夫妇” 再陷冷战
体育_中国足球	广州队发通知：新赛季做恒大足校球员的摇篮
娱乐_音乐	《当爱已成往事》武汉场圆满收官，爱未走远感动一直延续...
体育_CBA	郭艾伦缺席辽篮送宁波9连败 赵继伟25+9付豪砍24分
政务_反腐	重庆一落马官员有借不还敛财，被带走时还给下属安排工作
汽车_导购	带三个孩子出行不用愁 这款MPV能满足全家人的需求
汽车_试驾	试驾北京现代名图纯电动 这韩国欧巴很实在
娱乐_明星	易烊千玺人格权纠纷案胜诉 两公司已就侵权行为致歉
娱乐_电视	溜粉、抢番位、粉丝大战...这6部电视剧噱头比内容精彩
娱乐_电影	越来越猛男的“快银”｜赏色
政务_反腐	吉林高院原副院长吕洪民案剖析：恃才妄为，染上贪欲的“病毒”
政务_地方	聚焦关键之年 西安做好九个方面重点工作狠抓九大提升
政务_发展治理	中国修改教育法 完善冒名顶替入学行为法律责任
时尚_时装	王源冬野少年感大片
体育_CBA	CUBA揭幕战在川打响，西南交大夺赛区冠军！
体育_CBA	火爆！CBA2大名帅激烈对喷，李春江朝马布里飙国骂
体育_CBA	重磅罚单出炉：韩德君停赛7场 威姆斯5场 李春江马布里2场
体育_中国足球	抨击巩汉林冯巩！董路得罪天津相声界，条子哥嘲讽
时尚_情感	还记得《美人心计》的皇后薄巧慧吗？她的蓝颜知己竟是…
科技_5G	5G消息正式商用 惨遭网友嫌弃：号称“微信杀手”，发送却要收费
体育_CBA	中国女篮出访队伍新增7人核酸阳性
时尚_时装	舒淇明媚感桃花大片
时尚_情感	张嘉倪酷飒造型优雅又摩登
政务_政策	网约车司机权益保障有新规:规则协商，社保“兜底”
体育_NBA	莫兰特欲隔扣霍华德！联盟最喜欢隔扣的球员，浓眉哥和乐福曾中招
科技_数码	微软持续警告后 不受支持的Win11 PC电脑又出现了桌面水印提醒
时尚_美容	如何正确开启16+8轻断食？Esthe Pro Labo为你来支招
汽车_行业	在危机之前，福特和通用早已决定放弃俄罗斯市场
娱乐_电视	 邓伦偷逃税被罚：云米火速解约，Gucci等品牌宣传动态不可见
科技_车科技	福特：考虑按照油车电车划分业务
汽车_行业	合资品牌的“智能化”反击战：福特样本
政务_地方	湖北启动省级创新型产业集群建设 紧扣新一代信息技术、汽车、大健康等领域
体育_国际足球	4-0！曼城大胜诺维奇 斯特林上演帽子戏法
娱乐_音乐	周深，转行成OST专业户了？
科技_数码	PCIe 5.0显卡耗电：离开机跳闸的日子不远了
政务_政策	地方密集披露2020年“财报” 多省份财政收入由负转正
时尚_时装	迪丽热巴珠光粉宫廷风礼服
政务_地方	河南重点项目来了！1794个总投资约4.8万亿元
科技_手机	“卷王”醒目！摩托罗拉edge X30屏下版真机首曝
科技_区块链	美联社将推出新闻摄影NFT平台
娱乐_音乐	女星自曝在家装了双排马桶，跟老公一起如厕…网友：啊？
科技_手机	OPPO Find X5系列获工信部入网公示 2月24日发布
科技_数码	M1 Ultra版苹果Mac Studio比M1 Max版更重
体育_NBA	NBA防守球员榜：字母哥入榜跃升第一 戈贝尔追梦分列二三
娱乐_音乐	52岁的王菲，还会爱上水管工？
娱乐_电影	《保你平安》欢乐定档4月29日 平安兄妹约你萍水相逢五一档
汽车_新车	长安星卡PLUS开启预售 订车可享受5重权益
娱乐_电视	真尴尬！过时20年的烂套路，还在浪费好演员
科技_数码	就是贵 Zens发布高端AirPower充电垫
体育_国际足球	C罗战马竞进25球+4次戴帽 抓裆回击西蒙尼
体育_CBA	官方：郭士强质疑裁判+干扰比赛禁赛5场，罚款2万
政务_发展治理	中央环保督察通报案例：云南景洪生活垃圾处理问题突出
娱乐_电影	洗白绝世渣男？白瞎了这电影的全明星阵容
汽车_行业	对话魏牌高层：全面向高端智能新能源品牌转型
科技_数码	华为新笔记本、一体机问世：价格最高超1.5万！
时尚_美容	离开女团的她魅力爆棚了，这波舞台太秀了！
汽车_导购	广汽丰田的高品质如何实现？ 生产线上找答案
体育_国际足球	沙尔克04官方：决定移除球衣上主赞助商俄罗斯天然气的标识
政务_发展治理	10年新增191万人！合肥常住人口超阜阳、南京
政务_地方	江西将整治招商引资政策不兑现、公职人员腐败和作风问题
汽车_行业	贾跃亭造车成功？FF 91首款准量产车于2月23日发布
科技_手机	手机摄像头芯片产品降价 销库存成上半年挡路高山
娱乐_明星	周柯宇父亲成被执行人 执行标的291万余元
娱乐_电视	《猎罪图鉴》今晚开播  檀健次金世佳联手搭档共破谜案
娱乐_明星	台媒：李靓蕾无视纽约法院三次紧急命令，5个月不让王力宏见孩子
科技_手机	Find X5 Pro性能解析 以温控为核心主导体验
科技_数码	新款iPad Air发布：搭载苹果M1芯片支持5G网络 售4399元起
科技_区块链	以太坊创始人发表“人造子宫解放女性”言论，有人批想法太“乌托邦”
科技_手机	无可撼动的安卓机皇！三星S22 Ultra评测：集Note系列大成之作
政务_文旅	我国设立首批边境旅游试验区
体育_中国足球	意外！中国女足俱乐部收入领先九成外国同行
娱乐_电影	《唐顿庄园》《浴血黑帮》布景片场起火 11年前就曾发生火灾
时尚_美容	港普四金花再聚首，画面咋这么尬...
政务_政策	11月份70城新房价格：36城环比上涨 济宁领跑
汽车_试驾	Z时代的大潮玩？试驾吉利新缤越
政务_反腐	黑龙江鸡西市连续两任市政协主席任内被查
汽车_试驾	试驾哪吒U Pro 给予高性价比之选更多理由
政务_反腐	天津环卫系统一处长获刑十年半：多家车企送钱，女销售变情人
体育_NBA	科比夫人感谢爱犬陪伴：每当我哭时 它总舔我泪水
汽车_行业	俄乌战争下的车企：谁在退，谁上位？
汽车_行业	特斯拉推出TO B购车网站 主打低成本和零排放优势
娱乐_电影	温吞有余，犀利不足，这次他的口碑也扑街了？
科技_5G	一箭七星！星地融合5G试验网络“小蜘蛛网”组网成功
科技_手机	咬牙把手机做下去或许是传统笔记本企业的唯一出路
汽车_导购	全新荣威RX5 MAX设计解析 国潮的魅力
科技_数码	松下回应在美建厂为特斯拉供应4680电池传闻
时尚_情感	秀身材遭群攻 她是背锅还是活该？
体育_NBA	余华回忆科比与中国球迷的美好往事
科技_数码	一半价格买一半Macbook 断头Mac重新定义性价比
科技_数码	新一代黑砖：索尼发布高解析度音乐播放器 NW-WM1AM2，9999 元
政务_反腐	为了买买买 她贪污了群众救命钱
体育_CBA	CBA开出罚单：山西外援停赛2场罚5万 赵岩昊罚款1万
娱乐_明星	代餐碰瓷本人？山东刘浩存四川鞠婧祎宛如AI换脸，真宛宛类卿？
政务_反腐	浙江通报11起违反中央八项规定精神问题
娱乐_明星	张兰直播透露想孙子孙女 大方回应孩子抚养权问题
时尚_时装	林允羊毛卷法式大片慵懒随意
娱乐_音乐	韩国男团ASTRO成员JINJIN确诊新冠 文彬尹产贺正在等待检测结果
体育_NBA	24场1700万美金！NBA最贵兼职诞生 篮网妥协：欧文即将归队
科技_手机	真我V25发布：骁龙695处理器标配12GB内存 售1999元
时尚_情感	拥有超越原著的野心？这部剧做到了
科技_车科技	26万的极星2撞上500万的劳斯莱斯！网友：沃尔沃又赢了
政务_反腐	家风不正滋生腐败：父贪子随入狱 夫妻贪腐同日被惩
政务_文旅	河北正定古城重现“北方雄镇”风貌
政务_反腐	一天发布4名中管干部处分通报 反腐败斗争一刻不停歇
汽车_新车	2.0T+6AT动力组合 一汽奔腾B70S配置首度曝光
时尚_美容	10个小妙招！让你不靠整容就能变美
汽车_新车	长安星卡PLUS正式上市 新车售价4.99-6.39万元
体育_国际足球	上场10分钟，数据000！武磊评分全队倒数第3 已637天西甲没进球
体育_CBA	三连胜！杜锋赛前指导吴前，盛赞赵睿防守，MVP投篮10中1太尴尬
时尚_时装	舒淇上演了一场别样的游园惊梦
时尚_时装	MCM宣布小鬼王琳凯担任品牌代言人
科技_5G	中国移动、联通、电信发布重要公告：5G用户数大涨
娱乐_音乐	韩国女团“本月少女”经济公司财务困难 组合未来活动亮红灯
汽车_新车	整体延用海外版设计 奥迪A8L无伪装路试谍照曝光
科技_手机	罗永浩谈OPPO Find X5 Pro：后盖让人吃惊 质感真的很漂亮
娱乐_电影	探索“杀手”逆袭背后新丽电影的精品喜剧之路
科技_车科技	新能源汽车推广补贴清算：比亚迪狂揽29亿元 特斯拉超12亿
科技_数码	AMD、ARM、Intel、高通、三星、台积电等十巨头在一起！
科技_手机	安兔兔公布315假手机报告：上古神机华为P10排第2
政务_政策	2021省级两会时间陆续公布：1月中下旬扎堆召开 关注什么？
政务_政策	27省份试点门诊跨省报销，医保基金将迎来爆发性支出？
娱乐_电视	以食传情共织甜蜜爱恋 《尚食》许凯吴谨言今晚高甜大婚
政务_反腐	受贿300余次超百万，桐城市公安局原副局长获刑5年2个月
政务_地方	新规实施！河北省工程建设领域农民工工资权益有保障了
科技_车科技	特斯拉Model 3/Y中国齐涨价 三个版本上调1万元
时尚_时装	8套超实用见家长穿搭，让你得体又大方
政务_地方	孙春兰在吉林省调研时强调 采取最彻底的防控措施 尽快遏制疫情扩散势头
科技_区块链	2021全球数字货币市场年度监管政策盘点
