label	sentence1
体育_CBA	因身体原因，许利民不再担任中国女篮主教练
政务_政策	民政部：婚姻登记“跨省通办”6月1日起试点推行
娱乐_明星	邓伦被罚1亿，男明星挣钱到底有多容易？
娱乐_电影	《精灵旅社》迎来大结局 精灵家族相伴十年欢乐多
汽车_试驾	像装修豪宅一样讲究 智己L7内饰体验
政务_政策	盘点老龄化现状：哪些省份“养老育幼压力”接近50%？
科技_5G	3000份订单！华为5G传来好消息 美国白费心思了
科技_手机	首款7.56英寸骁龙8真全面屏！三星Galaxy Z Fold4工业设计首曝光
娱乐_音乐	易烊千玺发新单《四字歌》 人歌合一呈现本土化音乐
体育_国际足球	足总杯-曼城2-0客胜英冠垫底队 马赫雷斯+格拉利什各入一球
政务_政策	“十四五”：罕见病患者看病难看病贵该如何破解？
娱乐_明星	大S宣布闪婚后，前夫汪小菲首次露面，表情严肃面露憔悴
科技_手机	与华为合作的徕卡牵手小米！超大杯新机曝光：2022年安卓之光
时尚_时装	放下少女风造型又美又贵，体态改善气质翻倍，杨幂终于“逆袭”！
政务_发展治理	国家乡村振兴局：响鼓重锤抓紧抓好巩固拓展脱贫攻坚成果
科技_手机	困扰苹果多年！iPhone 13拍照鬼影问题OPPO Find X5给解决了
娱乐_音乐	民谣歌手赵已然去世 代表作《我是不是你最疼爱的人》
政务_政策	2020年中国经济为何能超预期？专家详解
时尚_情感	锤娜丽莎：GAG6 top出道，大码女孩正重建自信
时尚_美容	万圣节谁还认真扮鬼？当然要用漂亮浓妆惊艳全场啊！
时尚_情感	看完《浪姐》的群聊记录 我脑补了100部宫斗戏
科技_车科技	全球首例！自动驾驶公司开启中美业务切割
时尚_情感	都是娱乐圈批发渣爹，为什么只有他被骂？
体育_NBA	奥密克戎重创NBA始末，球队想派无症状感染者比赛
时尚_时装	吴磊祖国山水大片展少年风采
汽车_导购	解读广汽传祺全新第二代GS8：凭实力赶超合资品牌
汽车_导购	体验东风风神WindLink5.0：开启智慧出行全新体验
政务_文旅	我国首个古籍保护五年规划发布
时尚_情感	放生小三原配受罪，《三十而已》说好的独立女性爽剧去哪了？
娱乐_明星	赵本山徒弟媳妇吐槽：在本山传媒工作多年没赚多少钱
科技_手机	终于赶上iOS！安卓系统全新功能曝光
娱乐_音乐	2021奥林匹克公园音乐季开幕惊喜连连 经典民乐奏响“共同的家园”
时尚_美容	日抛可撕指甲油的使用技巧
政务_反腐	只赢不输的赌局：借打牌之名权钱交易，牌桌成为利益输送通道
政务_文旅	山东133个国有景区门票价格十一前将下调
时尚_情感	曾艳压李嘉欣，如今沦落到酒吧卖唱？“最美港姐”变直播网红，这也太惨了吧……
体育_国际足球	21-4变1-1！巴萨诞生78年耻辱 5500万标王掩面哭泣：8次射门脱靶
体育_CBA	内忧+外患！杜锋遇执教生涯最大挑战，广东的12冠王还有戏吗？
娱乐_电影	南京全市电影院暂停营业 网络购票平台均已无法购票
汽车_新车	埃尔法看见慌了 日产SENERA纯电动MPV路试谍照曝光
时尚_情感	以团圆之名，款待重要之人
科技_区块链	狗狗币一夜“腾飞”542倍 沈腾新晋“代言人”
汽车_行业	美国排放和新能源政策要变天了？
体育_中国足球	这就是队长！加时赛绝平+制胜点球 王珊珊当选全场最佳球员
体育_NBA	西部倒数第一！火箭吞7连败，伍德彻底被放弃，或正式开启摆烂
体育_国际足球	英媒：英超允许球员在场上表示支持乌克兰 并且不会出示黄牌
娱乐_电影	中国电影家协会：沉痛悼念电影事业家滕进贤
政务_发展治理	数字赶潮 上海“银发族”尝试融入“数字生活”
政务_政策	中央冬春救灾资金下拨 确保救灾款物及时足额发放
政务_发展治理	平均工资出炉！9行业年薪超10万，你是什么段位打工人？
政务_反腐	浙江一高校干部用公款带全家出游：谎报3岁儿子为外聘人员
科技_车科技	特斯拉柏林超级工厂实况 加速招聘大量制造、供应链岗位
政务_政策	北京：缓缴社保企业明年1月须“还清欠费”
时尚_情感	50岁影后超爱皱纹，大呼不让P图？
娱乐_电视	凤娱指数｜《猎罪图鉴》：绘画和破案结合，有亮点的双男主刑侦剧
娱乐_明星	还记得小鹿姐姐吗？47岁长这样？
时尚_时装	解锁IT Girl海莉·比伯同款宝藏配饰品牌Monica Vinader
时尚_时装	最高学历的港姐冠军下嫁穷小子，她赌对了吗？
汽车_行业	日产All in电动化 将停止研发大部分新汽油发动机
科技_手机	干得过苹果小米？蔚来也要造手机 小鹏、理想何时下场？
汽车_行业	丰田再次下调产量预期，季度利润大跌
娱乐_音乐	谢霆锋方回应歌曲被侵权 要求对方下架删除相关内容
娱乐_音乐	澳大利亚男歌手“戳爷”确诊新冠 此前已接种3针疫苗
科技_区块链	印度警方逮捕涉嫌加密货币骗局的多名欺诈者
政务_反腐	原长沙市国土资源局局长曾令亮之子被控共同受贿1800余万
政务_反腐	上半年张志南等6名中管干部被查 反腐数据说明了啥？
科技_手机	谁还用短信？
科技_手机	消息称iPhone 14全系设计已定稿：苹果摒弃刘海屏 启用全新外形
科技_数码	黑客来狠的了！100万美元出售LHR源码：RTX 30挖矿可满血
体育_CBA	林书豪奔赴诸暨赛区！出征前剪发 腰伤严重今年或无法出战
科技_车科技	2022年 新能源汽车卷在电池里
政务_发展治理	统计局：4月份猪肉价格继续下降11% 居民出行大幅增加
汽车_试驾	家用属性+1 试驾起亚智跑Ace 2.0L
时尚_时装	迪丽热巴香槟长裙未来感大片
科技_5G	日本、美国将联手建立6G无人化技术国际标准 防止中国企业垄断
政务_地方	河北积极对接京津 共同打造京津冀文化和旅游发展协同体
汽车_新车	全新大众Passat假想图 造型更显年轻动感
科技_车科技	315晚会曝光多品牌电动自行车违规提速 小牛电动最新回应
体育_NBA	超级逆转！独行侠末节一波流击败勇士 东契奇34+11
娱乐_明星	奚梦瑶富养女儿不含糊 两百多的围嘴买了13条
科技_手机	避坑指南 这三款手机配件我劝你别买
政务_反腐	株洲市城管局副局长刘坚被查，曾以大V身份活跃于网络
科技_手机	首款Android 13旗舰曝光：三摄横向排布 外形耀眼
时尚_美容	贵妇口红里含有这一物质，价格昂贵
汽车_新车	五菱推出凯捷 280T车型，动力表现多方位提升
政务_发展治理	杭州人口增量居长三角第一，这些区为何增长多
汽车_试驾	“卷”得恰到好处 试驾奇瑞瑞虎7超能版
娱乐_电影	《神秘海域》发布全新口碑特辑 久违嗨爽大片带你春游玩遍全球
汽车_行业	小鹏汽车成立自动驾驶子公司 Robotaxi业务将落地？
科技_数码	苹果宣布新版iMovie App：新增故事板和魔幻影片功能
娱乐_电视	《品质中国》节目2022年度全国选题正式启动
政务_反腐	贵州茅台一天内2人被查 如何斩断“以酒谋私”利益链？
体育_CBA	易建联缺阵！广东送福建6连败，任骏飞37分陈林坚26分，徐杰伤退
科技_数码	苹果计划引入日月光半导体生产自研5G基带
政务_发展治理	唐山通报“数百亩耕地里种树”：麦田毁损4.01亩
科技_数码	苹果公司全新处理器M1 Ultra跑分出炉 强无敌
科技_手机	一台旗舰两颗芯片，刚刚发布的Find X5会成为影像新宠吗？
体育_中国足球	中国0-2韩国！姚凌薇手球送点 对方一蹴而就
时尚_时装	林一上身迪奥冬季男装系列 释放诗意气质
体育_中国足球	12强赛开球时间：中国vs沙特3月25日0点 中国vs阿曼3月30日0点
娱乐_电影	人心有多狠，《毒战》就有多精彩
体育_中国足球	女足集体想要冰墩墩！水庆霞：能送我一个吗？央视记者为难：尽量
体育_中国足球	亚足联官方：长春亚泰退出2022亚冠
体育_CBA	20分惨败，广东队轰然倒下！易建联6中0，靠罚球得3分，杨鸣得意
科技_区块链	用户抱怨NFT无故丢失 OpenSea调查有关安全漏洞的传闻
体育_CBA	CBA最新排名！辽篮7连胜领跑 广东危机+首钢渔翁得利
科技_手机	2021年欧洲市场智能手机排行榜出炉：一国产品牌首次闯入前五
时尚_时装	全球动态｜Faroe Forest x 哥本哈根皮草发布联名设计师款；Burberry 公布生物多样性战略；李宁集团推出新品牌
科技_数码	最贵59999元！苹果正式发布Mac Studio 性能史上最强
科技_手机	传音手机 出海难逃一卷
科技_车科技	通用Cruise权力斗争大结局：CTO变CEO 新老板发文表决心
时尚_情感	零演技却靠放飞自我洗白 “美就够了”的她在娱乐圈还能走多远？
体育_国际足球	C罗失态！丢球后愤怒挥手念念有词 做望远镜手势宣泄对边裁不满
体育_NBA	新科三分王诞生！唐斯发挥神勇夺得三分球大赛冠军
体育_NBA	感动！克拉克森新纹身致敬科比 曾感慨老大是队友也是导师
政务_政策	幼儿园虐童频发戳痛社会 背后还有哪些需要堵的漏洞？
政务_地方	1—2月160个共建成渝地区双城经济圈重大项目有序推进
科技_区块链	NFT：一枚互联网“游戏代币”
科技_手机	告别“刘海”！分析师：iPhone 15系列4款机型将全部采用“双打孔”设计
娱乐_电视	凤娱指数｜《少年法庭》：韩剧最新力作，少年犯该不该杀？
政务_文旅	景区门票降价国庆前须见成效
娱乐_音乐	欧阳娜娜红裙惊艳似天鹅 手持大提琴气质满满
政务_文旅	贵州省122个自然保护区为濒危野生动植物撑起保护伞
娱乐_明星	又塌房！提醒督促后仍整改不彻底，邓伦偷逃税被罚1.06亿
政务_反腐	今年10月全国查处违反中央八项规定精神问题9309起
汽车_新车	法拉利Purosangue最新谍照 或将搭载V12自吸发动机
娱乐_明星	金星异国他乡吃饭被偶遇 与粉丝拍照交谈被赞“超级好”
科技_手机	OPPO Find X5 Pro天玑版登顶AI性能和能效榜，搭载天玑9000旗舰芯AI表现拉满
体育_CBA	单节10分，三分10中0！广东队被辽宁打爆了，狂输18分，杨鸣笑了
科技_手机	realme Narzo 50确认将于2月24日在海外推出 约1350元起
体育_NBA	知耻而后勇！被卫冕冠军打爆后勇士屠杀东部第一 全场138分创新高
体育_国际足球	利物浦点球胜切尔西夺英联杯冠军 四进球无效+凯帕失点
政务_反腐	山东地质矿产勘查开发局原局长郑金兰被开除党籍：干地矿吃地矿
汽车_新车	阿斯顿·马丁Valhalla/Vanquish消息 2024年开始推出
娱乐_电影	高分剧集分享｜《父母爱情》：原来爱情还是上一辈更甜
娱乐_明星	吴谨言许凯黑白故事感大片释出 深情对视暧昧氛围感拉满
汽车_导购	沃尔沃温馨提醒：买车前看看零整比，维修时或能避免交“智商税”
体育_中国足球	粤媒：广州队考察60名小将 组两队战中超和亚冠
汽车_新车	换壳大众途昂？上汽奥迪Q6路试谍照曝光
汽车_行业	加速自动驾驶卡车落地，主线科技完成B轮融资
科技_区块链	英国税务部门首次在执法过程中扣押NFT加密资产
体育_CBA	意难平！五名大将落选中国男篮，易建联领衔，广州北京核心在列
娱乐_明星	塌房塌歪了？丁真舅舅已婚已育还私联粉丝，疯版郑伊健也算明星？
汽车_试驾	真能无人驾驶了？威马W6的智能实用而非炫技
娱乐_明星	邓伦为偷逃税一事道歉：深刻认识错误，愿承担一切责任及后果
科技_手机	高通骁龙8 Gen2曝光：代工厂换为台积电
娱乐_音乐	iKON前成员金韩彬放弃上诉 一审因吸毒被判缓刑
体育_NBA	刷爆纪录！詹皇率队结束5连败，迎里程碑，赛后感慨：伟大的时刻
政务_政策	大修后的未成年人保护法将实施 有效落地需各方合力
时尚_情感	蔡少芬再上热搜：生在最差的家庭，却有最好的婚姻
政务_地方	重庆鼓励旅游企业建立“首席质量官”、“标杆服务员”制度
体育_NBA	遇见传奇！詹姆斯生涯出场数追平科比
汽车_新车	"日产纯电微型车最新谍照 或命名""SAKURA""/春季正式亮相"
政务_文旅	雄安新区公布非遗普查工作成果 共有非遗212项
政务_地方	河北省采取更有力措施 全力以赴做好森林草原防火工作
政务_反腐	哈尔滨呼兰扫黑：“四大家族”之一的“于区长”获刑25年
体育_CBA	十年恩怨！从球员到教练 回顾马布里和李春江斗争史
科技_手机	vivo首款折叠屏手机曝光：骁龙8 Gen1芯片 最快上半年公布
汽车_行业	月薪8000，赔偿100万，起底宁德时代竞业官司
体育_中国足球	唐佳丽：希望我可以为中英体育文化交流做出自己的一点贡献
汽车_试驾	ARCFOX极狐阿尔法S：做个有实力的网红
科技_手机	OPPO Find X5 Pro发布，比小米12 Pro贵一千，贵在哪了？
政务_政策	基本医保在“多层次”体系保基本、做基石
政务_地方	1-2月四川货物贸易进出口总值1587.5亿元 同比增长27.1%
政务_地方	杭州：数字化手段推动生态环境治理现代化
娱乐_电影	顾晓刚新作《草木人间》杭州开机 吴磊蒋勤勤首次合作演“母子”
汽车_导购	2021广州车展 钱够就值得买的纯电动车
体育_国际足球	塞内加尔赢得第33届非洲国家杯足球赛冠军
科技_5G	土耳其电信与华为签署5G协议谅解备忘录
娱乐_明星	刘欢亲弟和李谷一同台采访 曾为《父母爱情》写歌
政务_发展治理	四部门：建立健全农村家庭经济困难学生教育帮扶机制
汽车_导购	全新911 Turbo S：擒牛斩马只是表象，其实我是个“舒适”的超级跑车
时尚_时装	雎晓雯化蝶大片尽显空灵
科技_5G	全球十大电信基础设施品牌：华为居首，两家光通信企业入围
政务_发展治理	四川将推进全省减税降费政策标准、川渝两地重大政策标准“两个统一”
体育_NBA	一战成名！湖人新秀绝杀后展现高情商，盛赞威少传球太舒服
体育_国际足球	13年来首次！C罗连续6场不进球：空门不进+进球被吹 助攻也越位
科技_数码	就剩下一根线了 PS VR2发布支持4K HDR
汽车_行业	中国汽车出海再创佳绩 成最受俄罗斯欢迎的进口车
时尚_情感	女高中生毕业照被老师暴力P图遮住胸口和肩膀，因为“不端庄”？
科技_5G	已开通142.5万个5G基站 工信部表态：2022年再建60万以上
娱乐_音乐	布兰妮订婚了！和小男友晒钻戒，网友却苦劝：保护好你的钱
娱乐_明星	恋情疑曝光？ 何泓姗被拍与小九岁演员吴希泽牵手同游
娱乐_电视	《冰球少年》会员收官，致敬冬奥传递青春能量
体育_国际足球	国际足联官方：效力于俄罗斯的外籍球员及教练均有权解约
娱乐_音乐	郑容和出道12周年感谢粉丝：未来会继续用好的作品报答大家！
体育_国际足球	官方：海港新星加盟草蜢与李磊成队友 将租借前往克罗地亚练级
娱乐_电影	三浦春马遗作电影《天外者》将重映 五分钟幕后花絮首次公开
政务_发展治理	31个省份债务全解析：谁借钱最多，谁还钱压力最大？
科技_5G	全国政协委员黄改荣：研发5G穿戴 管理老人健康
政务_政策	教育部：加快开发家政托育养老等需求紧缺领域专业教材
政务_反腐	青海副省长文国栋投案，已有多名部下因木里非法采矿被查
体育_国际足球	意甲俄罗斯球员进球后拒绝庆祝 与乌克兰队友赛后拥抱
体育_NBA	NBA年终大战！篮网送湖人5连败哈登轰三双 詹姆斯39分9板7助刷爆纪录
政务_反腐	贫困县县委书记，被控受贿2231万
科技_手机	疑似一加10谍照曝光：工业设计与一加10 Pro大相径庭
科技_数码	郭明錤：苹果今年不会再推出mini-LED新品
时尚_美容	食醋排脂减肥 “酸”掉难缠脂肪
娱乐_电视	《人世间》周家儿媳的两种人生：郑娟像爬山虎，郝冬梅似凌霄花
政务_地方	河北推广“时间银行”互助养老 “低龄存时间，高龄换服务”
政务_文旅	350余场活动将亮相第二十届中国上海国际艺术节
娱乐_电视	总台《2021中国电视剧发展报告》公布 《觉醒年代》等上榜
体育_中国足球	因状态低迷，国足西征放弃征召武磊
科技_数码	郭明錤：2023款苹果Mac Mini将保留当前设计
时尚_情感	伊能静买了900件东西，没一件是给秦昊的？
科技_5G	全球5G智能手机销量在1月份首次超过4G
体育_CBA	男篮内讧！王哲林背后嘲讽郭艾伦赵继伟 网友围攻：算什么男人
体育_中国足球	尴尬！董路22年前新闻被扒 曾写错区楚良如今嘲讽巩汉林
科技_数码	Redmi K50系列预热：配备5000mAh电池和120W快充
时尚_情感	说实话，你们骂林有有的样子真丑
体育_CBA	23分大胜！赛后首钢球员集体发声，林书豪激动：没话说了
科技_手机	黑莓5G手机正式取消 开发团队官宣：停止开发
体育_NBA	克莱33分勇士送湖人3连败 库里24+8詹姆斯里程悲
科技_数码	英特尔进军的RISC-V 或许是国产芯片最后的希望
科技_数码	消息称台积电获得苹果全部5G射频芯片订单：最快有望用于iPhone 14系列
汽车_行业	Mobileye2024年将在美国推出自动驾驶摆渡车
科技_手机	小米骁龙8 Plus旗舰曝光：两个版本 屏幕大不一样
时尚_情感	C罗“准妻子”乔治娜真火了，从售货员变明星，穿礼服高调走红毯
娱乐_电视	网飞新剧片场失窃损失200万！遭20名蒙面人强行闯入，剧组已停演
科技_区块链	“网红”冰墩墩官方NFT盲盒将开售：国际奥委会授权、约626元一个
娱乐_音乐	凤凰传奇：没有结婚，钱对半分
时尚_时装	见闺蜜怎么穿才不输气质？学会这12套穿搭技巧，秒变气质女神
娱乐_音乐	《漠河舞厅》被抢注商标 当前状态为“等待实质审查”
政务_发展治理	第七次全国人口普查结果出炉！公布这些重要数据
政务_地方	为了大国粮仓、百姓饭碗，齐鲁大地正耕耘
科技_数码	OPPO Find X5 Pro天玑版破AI性能、能效纪录，搭天玑9000实力尽显
科技_5G	美撤销中国联通公司在美214电信运营牌照 商务部回应
体育_国际足球	欧足联宣布：终止与俄罗斯天然气公司合作！将俄超独苗逐出欧联杯
汽车_新车	爱驰U6 Cyber play版申报图曝光，面向运动纯电SUV市场
科技_区块链	为什么美国国会议员提出法案 禁止美联储发行CBDC？
娱乐_电影	法兰西玫瑰依然盛放
科技_数码	微软Win11记事本新增RichEdit编辑：将持续稳定更新
体育_NBA	7连败！开拓者成最令人失望的球队，利拉德三分尴尬，远不如库里
科技_区块链	扎克伯格三年发币梦破灭：高调开端 悲情落幕 中间满是辛酸泪
时尚_时装	冬奥顶流谷爱凌夺冠 其商业价值或超2.5亿元人民币
体育_CBA	全力以赴！郭艾伦赛后加练，杨鸣熬出黑眼圈，辽篮冲刺总冠军
汽车_行业	拜登政府为何关注电动车战略矿产？
时尚_时装	终于走出灰色市场的二手服装，能改变人们的观念和市场格局吗？
科技_手机	天玑9000为OPPO新旗舰 Find X5 Pro天玑版提供多个Buff加成，就一个字：稳！
娱乐_音乐	歌手萧敬腾：音乐之旅，终究要做回自己
科技_车科技	国家发改委：当前要着力解决汽车等制造业领域芯片短缺问题
体育_CBA	国际篮联更新排名！中国女篮距离第6仅差6分 美国女篮优势巨大
科技_车科技	自动驾驶之眼：谁在靠马斯克翻身？
体育_国际足球	欧冠-波兰巨星11分钟轰3球！拜仁总比分8-2晋级8强
科技_手机	2022年的OPPO旗舰：是平凡而自信？还是自研而自信？
政务_发展治理	儿童青少年近视防控方案：减轻学业负担、规范使用电子产品
科技_区块链	乌克兰网络警察部队开始接受加密货币捐款
政务_地方	RCEP实施前两月 甘肃逾千万元出口货物享优惠
科技_区块链	EternityX谈NFT营销形势：可从销售、购买、合作、捐赠四个方面应用NFT
体育_中国足球	官方：吴金贵回归担任上海申花主教练
科技_手机	3499元起！iPhone SE预售：京东3万余人预约 热度不及Redmi K50
科技_区块链	G胖谈区块链
时尚_美容	美白精华液哪个牌子好 口碑最好十大美白精华液排行榜
政务_地方	成渝交通一体化 动脉畅通激发双城活力
科技_手机	5000毫安时的安全感，Find X5 Pro重度使用能坚持一天吗？
娱乐_电视	《相逢时节》口碑两极分化，正午也翻车？张艺兴表现遭质疑
体育_国际足球	俄乌冲突后国际足联、F1等先后出手 俄罗斯体育界承受极限压力
汽车_行业	丰田2022财年前三季度财报：纯电车型仅售1.2万辆，占比0.15%
汽车_行业	高瓴大幅增持理想汽车和小鹏汽车
科技_5G	5G套餐用户比5G手机多出了近3亿 这意味着什么？
汽车_新车	雷诺Austral官图发布 新车四季度发售
政务_政策	着力稳外贸，国务院这些判断和部署有深意
科技_区块链	比特币之父“中本聪”真实身份曝光？马斯克：他是四家公司的合集！
科技_区块链	小鹏汽车申请元宇宙商标被驳回
娱乐_音乐	苏打绿开启专辑复刻计划 将重录过去经典专辑
科技_数码	微软Win11内置Clipchamp视频编辑工具遭吐槽
娱乐_明星	因王力宏李靚蕾离婚风波受牵连 徐若瑄透露两人有向她道歉
政务_文旅	国家移民管理局：全力应对“五一”假期出入境旅客高峰
娱乐_电影	《神奇动物3》终于定档，我整理了这篇前情回顾
政务_地方	中国全面推进成渝地区生态环境一体化保护
体育_中国足球	国足提前21天集训引名记质疑：身心俱疲，何必呢
汽车_新车	极星2“北极圈特别版”亮相 全球仅此一辆
科技_手机	真受不了iPhone的祖传炫光了 Find X5要改进这一问题了？
汽车_试驾	极限更高弯道中更有乐趣 赛道试驾领克03+ Cyan定制版
科技_车科技	电动汽车有望每周只需充电一次？锂硫电池关键障碍被突破
科技_5G	谷歌前CEO：5G比赛 美国“远远落后”中国
科技_车科技	集度首款汽车机器人概念车部分细节曝光
体育_国际足球	波兰晋级附加赛决赛 莱万：这是正确的决定
政务_政策	超1.7亿私家车主受惠！车检新规实施，10年内仅检2次
体育_CBA	输了比赛却发10万“平球奖”！球队总经理：奖励的是队员尊重赛场
时尚_情感	张继科约会失败，不怪金晨
科技_车科技	小鹏汽车申请元宇宙商标被驳回
娱乐_明星	69岁刘晓庆生图曝光，面部僵硬不自然，与精修照判若两人
娱乐_音乐	韩国音乐颁奖典礼MAMA投票涉嫌辱华 遭20多家粉丝抵制
政务_地方	代表委员畅谈乡村振兴 江西今年启动创建样板县乡村
汽车_试驾	试驾全新WEY拿铁 柠檬混动+电控悬挂同级领先
体育_中国足球	淘汰日本后 女足主帅拒被球员举起庆祝：还有1场硬仗！
体育_CBA	一黑到底！邱彪率队超越广东，并肩浙江，被指能力胜过杨鸣
娱乐_音乐	大湾区中秋音乐晚会众星云集 成龙李宇春黄晓明登台献唱
科技_数码	首次应用毫米波传感技术！余承东：新一代华为全屋智能来了
娱乐_电视	《春天花会开》今晚开播 新生代唱将云集开启民歌竞唱
体育_国际足球	这就是中国女足：连续3场逆转胜利 将不可能变为可能
时尚_美容	快手爆红的“蜘蛛腿”挑战，直接把我吓哭了
娱乐_电影	戛纳电影节宣布与TikTok达成合作 将增设短视频赛道
汽车_试驾	插电混动的真正意义 试驾比亚迪唐DM-i
政务_地方	落实收储政策 提升保供能力 江西省去年累计收购粮食190.7亿斤
体育_国际足球	瓜迪奥拉：津琴科很坚强 我们所有人都和他站在一起
汽车_试驾	星途揽月：一台产品力超强的自主7座SUV
时尚_美容	香奈儿回应盲盒争议：产品价值无法衡量
科技_数码	Win11自带软件被低估了！教你几招玩转它
科技_数码	回旋镖造型：三星全新折叠屏手机专利曝光
娱乐_电视	亚马逊85亿美元收购米高梅 成其历史上第二大收购交易
体育_CBA	CBA最新排名！大黑马登顶，辽篮吞赛季第2败，林书豪首秀开门红
政务_反腐	山西太原两换届未获提名干部主动投案：自己预感事情已经败露
科技_车科技	宝马汽车：在俄乌局势和芯片危机中优先考虑电动汽车
体育_中国足球	媒体人：国脚高薪低能降薪罪有应得 但不同意最严限薪令出台
时尚_美容	美白精华有用吗 最顶级的美白精华产品大放送
体育_CBA	林书豪谈辽粤赛后球迷种族歧视言论：要给别人尊严和尊重
体育_国际足球	神帅！水庆霞两次换人造点+扳平+绝杀 赛后被女足姑娘们高高抛起
政务_政策	春节干三天多领四成工资，但你有权对加班说“不”
体育_CBA	CBA联盟致广大球迷的公开信：文明观赛 有你有我
